File Name,Skills
37374340.pdf,confidential data protection
39082090.pdf,"payroll, training, hedis, audits, cases, database, billing, business consultant, business development, coding, healthcare, medicare, outpatient"
41910253.pdf,"epic, microsoft office suite wordexcelpowerpoint, healthcare systems, insurancebilling, sorian scheduling, healthmedical records"
43994605.pdf,"administrative, basic, budget, cpt, dependable, documentation, fast, forms, funds, icd, team leader, medical assistance, works"
45907524.pdf,"administrative functions, administrative support, art, automobiles, basic, changing bed linens, benefits, bookkeeping, charts, cpr, client"
46349752.pdf,"caring for patients with musculoskeletal diseases and disorders, assisting with activities of daily living, administering intravenous medications"
47996197.pdf,"digital media, digital marketing, social media, email, direct mail, mobile, promotions, branding, customer acquisitionretention, analytics"
49325370.pdf,"accounts receivable, administrative assistant, basic billing, cms, excellent interpersonal skills, cpr, email, faxes, filing, law enforcement, loss"
51777546.pdf,"accounting software, administrative, audio, benefits, c, contracts, client, data management, dc, documentation, senior management, forms"
54934269.pdf,clerical organization skills
56520872.pdf,"acute care, billing, case management, charts, chemotherapy, closing, coaching, client, clients, discharge planning, insurance, director, meetings"
58879993.pdf,"knowledge of medicare, medicaid, eeoc, hippa, fmla  ada"
60624892.pdf,work history
64471954.pdf,telecommunications knowledge
69199666.pdf,"ads, autism, benefits, billing, coach, coaching, client, clients, data processing, delivery, drivers, filing, financial statements, hiring, inventory"
75297735.pdf,drives engagement
75744306.pdf,proficient with microsoft office suite
80876647.pdf,"administrative, ambulance, basic, cpr certified, first aid, inventory, life support, logistics, microsoft office, office, personnel, fast learner"
85417107.pdf,"microsoft office  years, talent acquisition, talent management, recruiting, staffing, business development, training and development"
85421438.pdf,"ads, advertising, book, brochure, cash register, content, credit, client, clients, customer service experience, direction, email, event planning"
87520378.pdf,"excellent interpersonal skills knowledgeof medicare, medicaid, eeoc, hippa, fmla  ada"
91478356.pdf,patient services patient assessments
93988900.pdf,"academic, acute care, adobe acrobat, adobe photoshop, alpha, ambulance, army, behavioral health, chinese, coach, consulting, cpr"
95011061.pdf,"agency, benefits, hardware, cpt coding, client, clients, customer service, direction, financial, icd, information systems, insurance, leadership"
96260484.pdf,"academic, accounting, administrative, balance, biology, business development, business law, chemistry, interpersonal, ca, consulting"
97169343.pdf,good judgment
98300955.pdf,"net, aspnet, active directory, agile, ajax, api, architect, automate, bi, business intelligence, cascading style sheets, excellent"
98309114.pdf,"lean six sigma improvement methodology, advanced analytics, data management, process and performance improvement planning, financial"
10399912.pdf,"filing, clerk, maintenance, clerical, office clerk, clerical support, data entry, faxing, incoming mail, legal documents, mail clerk, office"
10694288.pdf,"proficient in all microsoft applications and hris systems banner, peopleadmin, personnel management information pmis system and"
11480899.pdf,"overseeing and manage all administrative activities of the company, ensuring that all work processes are maximized for efficiency"
11592605.pdf,"administrative, administrative assistant, bi, conferences, database, special events, filing, human resource management, hr, human resources"
11698189.pdf,critical thinking
11763983.pdf,"aca, adp payroll, as, benefits, benefits administration, consultation, erp, hiring, hris, internet explorer, kronos, labor relations, excel"
11847784.pdf,management consultation
12786012.pdf,performance management strategies certified professional human resource management
13376919.pdf,"assistant manager, banking, counseling, clients, hiring, hr, marketing, ms excel, office, ms outlook, ms powerpoint, ms word, negotiations"
13520837.pdf,"excellent oral and written communication skills, an ability to multitask, strong attention"
13879043.pdf,"benefits, budget, client, delivery, hiring, human resource, hr, insurance, leadership, people management, managerial, managing, market"
14225422.pdf,"adp payroll, attorney, benefits, billing, billings, ceridian, charts, coaching, competitive, contract negotiations, counseling, employee relations"
14256329.pdf,excellent telephone manner and high standard of communication skills
14640322.pdf,talent aquisition
14886205.pdf,new employee orientations quickbooks
15375009.pdf,"administrative, adp, backup, benefits, bookkeeping, clarify, competitive, customer service, database, delivery, documentation, employee"
15575117.pdf,"administrative, administrative assistant, administrative support, attorney, benefits, call center, clerical, conferences, client, customer service, data"
15576950.pdf,"benefits, central point of contact, clerical, conferences, cpr, customer service, data entry, directing, documentation, fashion, faxes, focus, hiring"
16852973.pdf,"accounting, ads, advertising, analytical skills, benefits, billing, budgeting, clients, customer service, data analysis, delivery, documentation"
16861758.pdf,courteous demeanor
16877897.pdf,"sap r, ms office word, excel, power point, outlook, internet applications have good understanding of sql, html, css and"
17150707.pdf,"administrative, adp, backup, benefits, counseling, client, customer support, documentation, forms, hris, human resource, human resources"
17412079.pdf,"benefits, budget, client, delivery, hiring, hris, human resource, hr, insurance, leadership, people management, managerial, managing"
17422560.pdf,"cash receipts, cash handling, cash register, client, customer service, data entry, direction, employee relations, faxes, fax machines, hiring"
17812897.pdf,hr department startup
17855844.pdf,"ada, administrative, adobe illustrator, art, agency, benefits, ceridian, change management, decisionmaking, dca, employee relations, special"
18084150.pdf,"adp, benefits, budget, databases, employee relations, special events, senior management, general manager, hiring, hris, insurance, kronos"
18155310.pdf,"customer service, receptionist, retail sales, advertising, budget, corrective action, cost reduction, forecasting, maintenance, office"
18297650.pdf,"net, academic, accounting, aims, c, c, closing, cold calling, contracts, client, data modeling, database, data warehousing, fast, focus"
18316239.pdf,"abc, adp, adr, benefits, benefits administration, budget, coaching, us army databases, driving, employee relations, training employees"
18334783.pdf,employee relations
18422164.pdf,personnel records maintenance
18557164.pdf,"administrative assistant, attention to detail, banking, benchmarking, clerical, excellent communication, competitive, consultant, customer service"
18731098.pdf,work history
18827609.pdf,employee relations
19179079.pdf,"recruiting, staffing, training, college recruiting, sourcing, phone screens, interviewing, negotiation, recruiting events, new hires, onboarding"
19336728.pdf,high energy
19616406.pdf,"processing accounts payable, administrative, administrative support, ads, audit reporting, reconciling bank statements, benefits, bonds"
19717385.pdf,"microsoft excel, outlook, powerpoint, word"
19867922.pdf,"administrative duties, administrative support, adp, ad, attention to detail, basic, benefits, bi, calendar maintenance, call center, copying, data"
20417897.pdf,"accountant, administrative support, benefits, billing, brochures, budget, bi, charts, contracts, copying, clients, documentation, drafting, engineer"
20806155.pdf,"hr, maintenance, registrations, staffing, training, access, account maintenance, general account, access control, architecture, archiving"
20925036.pdf,"agency, banking, basic, benefits, business administration, bi, ctc, client, fast, focus, forms, gdc, hiring, hr, team building, leadership, excel"
20993320.pdf,"creative problem solving skills, o rganized with attention to detail, c omputer proficient, customer service, b enefits, p ayroll, r ecords"
21265194.pdf,title vii
21830565.pdf,employee relations
22323967.pdf,"adobe photoshop, adp, asset management, branding, brochures, content, customer care, final cut pro, graphics, graphic, hr, illustrator"
23155093.pdf,providing focus and direction
23408537.pdf,shrm  hr generalist certificate
23510685.pdf,"adobe acrobat, analyst, architect, balance, basic, benefits, budget management, calibration, charts, consulting, contracts, client, data analysis"
23914451.pdf,"associate relations, audits, asset protection, coaching, eeoc responses, succession planning, terminations, customer service, retail sales"
24184357.pdf,recruiting and staffing performance management employee relations selectionrecruiting
24402267.pdf,"hris, iso, recruitment, performance appraisal, training  development, leave  attendance, entry  exit"
24508725.pdf,"adp, avid, benefits administration, billing, budget, interpersonal skills, counseling, credit, clients, databases, documentation, employee"
25150191.pdf,ms office suite
25676643.pdf,hr advisory services
25724495.pdf,"banking, closing, clients, employee relations, financial, forecasting, hiring, hris, hr, leadership, legal, letters, mailing, managerial, managing"
25824789.pdf,"ada, administrative skills, administrative, coaching, employee relations, training employees, english, special events, hiring, hris"
26048718.pdf,hyperion employee relations
26202430.pdf,strong interpersonal skills
26289308.pdf,"benchmarking, benefits, bi, cost reduction, documentation, engineer, executive coaching, senior management, financial, fsa, hr, insurance"
26671167.pdf,independent worker
26780935.pdf,"carl henry modern sales training, clientfocused, effective communication skills, event management, leadership, microsoft office proficient"
27018550.pdf,type  wpm and key by touch
27165830.pdf,employee relations advising and navigating crucial conversations
27490876.pdf,"administrative, ad, arbitration, agency, budget, consultant, database, employee relations, hiring, hris, human resource, human resources, hr"
27496514.pdf,"accounting, agency, benefits, clientele, client, clients, database, delivery, department of health, fax, filing, hr, insurance, marketing plan"
27523575.pdf,experience
27847081.pdf,"word, excel, powerpoint, outlook"
28175164.pdf,"peoplesoft, microsoft office suite, adp, and sap"
28419173.pdf,"administrative support, antivirus, billing, budget, oral communication, conferences, clients, customer satisfaction, databases, documentation"
28640735.pdf,"accounts payable, accounts receivable, benefits, benefits administration, billing, budgets, budget, coaching, contracts, council, client, clients, dc"
28808263.pdf,"originated new business through professional networking, loan reviews and marketing"
28828844.pdf,"administrative support, adp, benefits, coaching, excellent communication, conflict resolution, conflict resolution, consultation, creative problem"
29091445.pdf,"ms office word, excel, outlook and powerpoint sap database, applicant tracking system  strong organizational and adminstrative skills"
29149998.pdf,great analytical skills new hire training
29297973.pdf,onboarding
29564653.pdf,"excel, human resources, ms excel, training, adp, pivot tables, recruiting, adp software, billing, eprise, onboarding, testing, administrative"
30163002.pdf,"business development, central point of contact, closing, client, clients, email, employee relations, fashion, fast, faxes, meetings, access, mail, office"
30563572.pdf,"selfmotivated, detail oriented, organized, customer focused"
30646367.pdf,"abra, academic, benefits, benefits administration, billing, bi, ceridian, conflict resolution, crystal reports, hris, human resources, hr"
30862904.pdf,"ada, art, benefits, benefits administration, biotechnology, branding, budget, change management, contract negotiations, contract negotiation"
32308556.pdf,human resource management
32896934.pdf,"accounts payable, administrative, administrative support, ap, benefits, benefits administration, bookkeeping, clerical, continuous improvement"
32947778.pdf,recruiting hris technologies
32977530.pdf,expert in customer relations large cashcheck deposits expert
33176873.pdf,recruiting benefit administration
34554248.pdf,"accounting, ada, advertising, benefits, benefits  administration, bookkeeping, budgeting, business law, business research, business startup"
34740556.pdf,employment law
39081840.pdf,payroll  benefits administration  employment law  fmlaadaeeowc  hr policies  procedures  staffing
39650734.pdf,human resource management skills
41523474.pdf,computer skills
44476983.pdf,leadership development time management
47470864.pdf,"administrative, banking, basic, benefits, call center, clerical, coaching, client, clients, database, documentation, employee relations, fax, filing"
49937469.pdf,"academic, ai, attention to detail, backup, benefits, benefits administration, budget, cash receipts, coaching, contracts, critical thinking, customer"
51769822.pdf,office support
52979663.pdf,"ada, approach, arbitration, auditing, business strategy, case management, contract negotiations, crisis management, finance, functional, hris, human resource, human resources, hr, information systems, iso, leadership, material science, money, negotiating, negotiation, negotiations"
57667857.pdf,employee relations
59962788.pdf,new employee orientations
72231872.pdf,"accounts payable, accounts receivable, ada, administrative and support, ads, advertising, backup, benefits, benefits administration, brochures"
73077810.pdf,"adp, benefits, closing, coach, coaching, competitive, customer service, database, hiring, hris, hr, insurance, logistics, director, mentoring"
80162314.pdf,staff recruitment  retention
86184722.pdf,"microsoft office suite, sap, kronos, ibm, adp, ats, mss, hrss, and oracle, workbrain, t"
87968870.pdf,"ada, adp, benefits, clarify, employee relations, human resource, human resources, hr, insurance, law enforcement, mediation, ms office"
91930382.pdf,"bullhorn, boolean searches, google resume search, linkedin xray search, the ladder, github, tech fetch, monster, career builder"
93002334.pdf,"systems excel, outlook, power point, visio, one note, share point, sap, advise hr, siebel, talx, autonomy, survey monkey, taleo"
93112113.pdf,"professional human resources certification phr, june"
10089434.pdf,"active directory, azure, antivirus, backup exec, backup, bash, batch, cacti, cisco asa, databases, dhcp, dns, documentation"
10247517.pdf,"antivirus, backup, cabling, cisco, hardware, contracts, client, clients, database, disaster recovery planning, disaster recovery, email, erp"
10265057.pdf,"big data, c, c, charts, circuit design, hardware, data acquisition, data analyst, data collection, data mining, databases, database, dbm, dti"
10553553.pdf,"active directory, administrative support, adobe acrobat, architect, backup, budget, clientserver, hardware, concept, client, clients, client"
10641230.pdf,"a certified, actionscript, active directory, administrative, adobe creative suite, photo, audio, brochure, budgeting, business management"
10839851.pdf,desktops
10840430.pdf,"air force, art, agency, basic, budget, oral, hardware, computer operations, configuration management, cost analysis, data management, dec"
11580408.pdf,"a certified, active directory, billing, business process, c, cash flow, cisco, cisco routers, hardware, network systems, content management"
11584809.pdf,system administration
11957080.pdf,"applications ms office suite, o, groupwise, heat call logging, crystal reports, t voicemail, netmotion, novell"
12045067.pdf,"administrative, analyst, army, agency, cable, cabling, cat, documentation, engineer, engineering support, financial, functional, government"
12334140.pdf,"accounting, administrative, agency, basic programming, bookkeeping, business communication, hardware, finance, fundraising, help desk"
12635195.pdf,google and microsoft suite experience through coursework and classroom implementation
12763627.pdf,"asp, aspnet, model view controller, modelviewcontroller, ms asp, mvc, net, access, adp, application software, aspnet, associate"
13385306.pdf,"net, aspnet, vbnet, adabas, ado, agile, application development, asp, agency, banking, banyan, billing, business analysis, business"
13405733.pdf,agile framework sql microsoft and oracle
13477922.pdf,"a, a certification, active directory, ccna, cisco certified network associate, hardware, consultation, client, dhcp, email, fax machines"
13836471.pdf,"d, active directory, adobe products, apple, automation, backup, broadcast, budget planning, computer technician, hardware installation"
14789139.pdf,"academic, active directory, adp, apple, architect, agency, bb, behavioral health, billing, book, broadvision, cad, case management"
15297298.pdf,"adr, advertising, arcserve, asset management, agency, backup exec, backup, banking, budget management, budgeting, business operations"
15651486.pdf,"ad, budget, change management, cisco ios, cisco, cisco routers, hardware, contracts, clients, database, dell, dell poweredge servers"
15791766.pdf,"a, active directory, agile, avaya, call center, excellent communication, ca, hardware, contracts, critical thinking, customer service, decision"
15802627.pdf,"business continuity, technology infrastructure, file, lan, architecture, business process improvement, cdm, cisco, contracts, ecommerce"
16186411.pdf,"aspnet, vbnet, active directory, adonet, dreamweaver, web development, agile, ajax, html, ide, java, javascript, jquery"
16533554.pdf,"platforms windows, server and professional, windows xp pro           and home, win"
16899268.pdf,project management resultsoriented
17111768.pdf,able to convey highly technical concepts in a manner that all can understand
17641670.pdf,"a, active directory, adobe acrobat, approach, automation, backup, tape backups, budget, business development, ccna, cisco certified"
17681064.pdf,"streamline, banking, budget, business systems, c, cisco, closing, consulting, contracts, crm, client, customer service, ebusiness, email"
17688766.pdf,"accounting, active directory, antivirus, antivirus, apple, arcserve, audio, backup, bgp, budgets, cisco routers, citrix, hardware, contracts, dhcp, disaster recovery, dns, firewalls, firewall, focus, ftp, hardware configuration and troubleshooting, hp, imaging, ip, lan, leadership"
17987433.pdf,"microbial testing, endotoxin lal test"
18067556.pdf,"microsoft office suite with deep office, dynamics, project, powerapps, powerbi, flow"
18159866.pdf,experienced in strategic planning and execution
18176523.pdf,"com, a, active directory, backup, bay networks, business systems, cisco, citrix, hardware, network systems, clients, direction, disaster"
18187364.pdf,certified information systems security professional cissp isc patch management
18301617.pdf,"active directory, adobe, antivirus, backup exec, backup, budget, business processes, call center, call center, capacity planning, cisco"
18752129.pdf,"apple, art, book, oral, concept, conflict resolution, cpr, creativity, designing, direction, documentation, first aid, flash, fundraising, drawing"
19201175.pdf,hardware updates task estimation
19796840.pdf,"peoplesoft hcm x, peoplesoft financials x, peopletools, sql developer, ms office, visio, ms project, dell stat"
19850482.pdf,"demonstrates ability to be a strong leader in a fast paced environment with strong interpersonal skills, both written and oral, and a positive attitude"
20001721.pdf,structured query language sql expert strong analytical skills
20024870.pdf,"language chinese, english and japanese"
20408458.pdf,"a, active directory, apollo, army, com, hardware, data migration, dell, email, engineer, flash, hp, ibm, image, intel, inventory"
20674668.pdf,technical skills
20824105.pdf,"ip networking protocols tcpip, udp, https, dhcp, dns, stp, hsrp, isis, rip, ospf, mpls, ftp, smtp, ipsec, vlan, vpn"
20879311.pdf,"active directory, antivirus, asset management, backup exec, budget, business systems, cabling, cisco, competitive, hardware, consulting"
21283365.pdf,communication
21780877.pdf,"budget, cabling, cisco, hardware, client, documentation, electrician, feasibility studies, funds, information technology, inspector, lan, materials"
22450718.pdf,"working knowledge of application servers, jee, oracle, unix os, linux, ldap"
22776912.pdf,"accounting, accounting systems, streamline, application development, bb, backup, broadband, budgeting, budget, business analysis and"
23527321.pdf,sap
23666211.pdf,"administrative, consultant, course development, client, dc, delivery, instructor, leadership development, leadership and development"
23864648.pdf,infrastructure management data center operations project management team buildingcoaching vendor
24020470.pdf,dhcpdns ethernet and firewall proficient microsoft office specialist
24038620.pdf,"air force, attorney, backup, balance, billing, budget, business operations, interpersonal, competitive, crm, client, clients, dictation, disaster"
24083609.pdf,resultsoriented dedicated team player
24230851.pdf,microsoft office
24889109.pdf,excellent interpersonal skills presentations  training  documentation standard operating procedures development
24913648.pdf,remote access support
25207620.pdf,"years experience security intermediate, years experience customer service expert, years experience networking intermediate"
25857360.pdf,wpm typing speed
25905275.pdf,"army, clerical, good communication skills, hardware, computer knowledge, contracts, excellent customer service, customer service, customer"
25959103.pdf,"arabic, backup, budgets, hardware, client, database, database management, designing, disaster recovery, documentation, financial, help desk"
25990239.pdf,"photoshop, premier, art, cable, hardware, computer repair, curriculum development, client, customer service training, database, department of"
26480367.pdf,"active directory, antivirus, c, cable, cat, computer hardware, hardware, client, clients, email, front page, hard drives, hardware support, html, ids, internet access, local area network, layout, domino, office applications, microsoft office, windows, microsoft windows  server"
26768723.pdf,able to research and familiarize skill sets towards core technologies
26801767.pdf,"academic, administrative, agency, basic, benefits, broadband, budgeting, budgets, cobol, hardware, computer applications, conferences"
27058381.pdf,computers trouble shooting microsoft access microsoft excel microsoft powerpoint microsoft word computer security anti hacking hids
27295996.pdf,"active directory, dhcp, dns, wins, gpo, backups, budgeting, citrix, xenapp, vmware, hyper v, dynamic crm, dynamic gp"
27372171.pdf,"active directory, microsoft outlook, windows, windows, system security, data automation, circuit design application, unix client"
27485716.pdf,"a, acquisitions, backup, budget planning, budgeting, budgets, budget, business development, change management, conversion, decision making"
27536013.pdf,"branding, budgets, budget, business analysis, bi, business intelligence, business management, business objects, crm, data analysis, data"
27770859.pdf,"platforms and protocols microsoft windows, microsoft windows server, microsoft active directory, microsoft group policy, microsoft office"
28035460.pdf,microsoft products
28672970.pdf,"accounting, analyst, business processes, change management, cisco certified, coaching, hardware, conversion, clients, direction, email"
28697203.pdf,budget
28897981.pdf,skills experience total years last used
29075857.pdf,"qa, offshore, annuities, testing, team lead, database, qa validation, sdlc, metrics, project planning, qa test, qa testing, benefits, excel"
29975124.pdf,"application development, lotus approach, asset management, billing systems, book, budget, develop business, business process analysis, c"
30223363.pdf,"database, marketing, systems analyst, project management, business requirements, solutions, metrics, qa, documentation, accountable for"
31111279.pdf,"passion for pmo shines through my work, and i strive to and pm skills are equally crucial to a high performing team"
31243710.pdf,"a, active directory, adobe, apache, backup exec, budget, business process, c, ccna, cisco ios, cisco, citrix, hardware, crm, client"
32959732.pdf,forecasting specialist
33241454.pdf,"army, cisco, counseling, customer assistance, database, documentation, information technology, inventory, ip, lan, windows, network"
33381211.pdf,people centered leadership
35325329.pdf,"streamline, agile, billing, case management, contracts, clients, customer services, database, dictation, documentation, electronic medical records"
36434348.pdf,"aspnet, active directory, adobe acrobat, adobe dreamweaver, adobe photoshop, application design, arts, billing systems, business objects"
36856210.pdf,enterprise platforms
37242217.pdf,"oracle i, sage act optimizing and performance tuning"
37764298.pdf,"administrative duties, adobe acrobat, schedule appointments, asset management, agency, attorney, balance, basic, billing, billing system, cashier"
39413067.pdf,skills
39718499.pdf,"audio visual, games, coaching, customer service, fast learner, receptionist, retail sales, landscaping, maintenance, marketing"
40018190.pdf,sharepoint sap
41344156.pdf,"aspnet, aspnet, vbnet, active directory, backup, budget, contract negotiation, crm, data analysis, data processing, databases"
46260230.pdf,issue escalation server and system administration
48037995.pdf,creative cognitive skills
