File Name,Skills
39674782.pdf,"arcview, autocad, business development, business management, consulting, council, cpr certified, employee relations, government"
39908485.pdf,construction estimating  management team building  leadership
44147689.pdf,"paradox, microsoft office suite"
45475027.pdf,interpersonal communication skills
48549972.pdf,"audit reports, cpr, filing, forklift, office, office management, personnel, policies, risk analysis, safety, unique"
49685006.pdf,professional verbal and written communication deadlineoriented
51638201.pdf,"administrative, blueprint, budget analysis, budget development, budgets, budget, interpersonal communication, compliance manager, conflict"
56525735.pdf,accomplishments
61065616.pdf,"cables, calibration, inspection, laboratory testing, logging, masonry, procurement, proofing"
63083944.pdf,customer service
63145386.pdf,"account reconciliations, accounts payable, accounts receivable, adobe acrobat, adobe, photoshop, streamline, auditing, autocad, banking"
69764348.pdf,generator operation  maintenance skills including automatic transfer switches and aircraft arresting systems
71576860.pdf,strong communication skills
78114950.pdf,subcontractor supervision
78298706.pdf,forklift operation
88859947.pdf,"account management, active directory, adobe, backup, backup, budgets, business analysis, cisco, client and server, coaching, hardware"
90032884.pdf,"deployment, engineer, million, project management, security, detail oriented, managerial, problem solving, selfstarter, team lead, concrete"
93436805.pdf,time management
94503308.pdf,"army, banking, billing, budget, cad, direction, documentation, drafting, eia, financial, hvac, insurance, managing, materials, meetings, pricing"
99433371.pdf,"administrative duties, adobe photoshop, autocad, color, data entry, digital illustration, illustrator, inspection, insurance, interior design"
10332998.pdf,court procedures due dilligence
10984392.pdf,negotiations
11020140.pdf,requirements and documentation
11333660.pdf,"ad, articulate, budget, concise, conferences, consulting, copy editing, client, clients, data collection, data entry, drafting, editor, editorial, fast"
11415967.pdf,"biology, bsc, chemistry, interpersonal, community relations, cost control, clients, database, drafting, economics, eia, english, environmental"
11835339.pdf,banquet  catering director
12251115.pdf,"advertising, consultant, training employees, staff training, fast, hiring, hr, inspecting, inventory, managing, marketing, excel, operations"
12374933.pdf,"deployment, maintenance, active directory, testing, workstations, access, technical support, printers, blackberry, windows server"
12526702.pdf,oversaw quality assurance initiatives to design and implement products and processes for ongoing projects
12897903.pdf,employee relations
12955994.pdf,"account management, account reconciliations, accounting, acquisitions, agile, art director, agency, bb, book, budgets, budget, business"
13215696.pdf,patient and diligent
13313917.pdf,"attention to detail, automation, basic, budgets, budget, business development, developing business, business planning, business plans, c"
13454871.pdf,applications  r and i
13569152.pdf,consistent with meeting needs of st century learners
13586069.pdf,"healthcare analytics  years, physician engagement  years, project management  years, consulting"
14346702.pdf,"administrative support, balance, cpr, clients, customer service, delivery, forms, inventory, managerial, microsoft office suite, office automation"
14517953.pdf,experience
14593060.pdf,"accounting, active directory, antivirus, automation, backup, budgets, ccna, cisco certified network associate, certified novell engineer"
15083600.pdf,"implementation level knowledge of front arena, adaptiv, opics proficient in excel, powerpoint, word, access"
15119529.pdf,com
15281412.pdf,microsoft net visual basic and c
15433732.pdf,"contentcollateralweb design with adobe creative suite, html, css, javascript, php client, ms office"
15535920.pdf,complex data transformations project management
15602094.pdf,adobe photoshop
15699744.pdf,bb and bc expertise project management
16964217.pdf,patientfocused care
17025292.pdf,"a, active directory, auditing, automation, avaya, backup exec, budget, cables, cdrom, changemanagement, citrix, hardware, encryption"
17307206.pdf,"communication skills, computer literate, credit, addressing customer concerns, people skills enthusiastic people person, advanced problem"
17983957.pdf,assessment
18079050.pdf,"accounts receivable, accruals, book, credit, debit, documentation, forms, general ledger, legal, excel, outlook, microsoft word, oracle"
18227306.pdf,"accounting, accounts receivable, agency, bookkeeping, budgeting, budgets, contracts, client, clients, client relations, customer support, english"
18856440.pdf,professional demeanor
19161572.pdf,professional experience
19936735.pdf,media consulting and digital content analysis
20176584.pdf,haccp certified
20314980.pdf,"vbnet, aspnet, active directory, adding machines, streamline, ad, application packaging, automate, backup, hardware, conflict"
20574232.pdf,"accounting, active directory, ad, apache, backup, bloomberg, cisco, citrix, clientserver, hardware, client, databases, database, dell, dhcp"
21156767.pdf,sql servermysql
21366189.pdf,skills experience total years last used
21512769.pdf,"anatomy, biochemistry, oral, delivery, dermatology, documentation, english, family medicine, focus, genetics, gmp, health education, hindi"
21568833.pdf,"accounting, accounts payable, accruals, ap, auditing, balance sheet, bank reconciliation, banking, bc, bloomberg, bonds, business law"
22259768.pdf,requirements gathering
22351830.pdf,"adp, api, architect, automotive, basic, business process, cisco, coaching, com, ca, version control, database, dsl, eclipse, fluent in"
22485475.pdf,"microsoft word, powerpoint, excel  office project evaluation media relations employee and volunteer training grant certification project"
22556198.pdf,"administrative, administrative functions, attention to detail, benefits, budget, cancer, case management, conferences, contracts, data collection"
22571461.pdf,project management
23302948.pdf,pressure and rate transient analyses
24643412.pdf,"sql, html, asp, mysql, php, net, ajax, business analysis, c, contracts, ms sql server, sql server, os, realtime, database, unix"
24828381.pdf,"ambulance, basic, conflict resolution, cpr, documentation, human resource, management training, office, nursing, publications, radio"
25213006.pdf,crm expertise superb sales professional
25258040.pdf,"administrative, as, benefits, bi, business process, credit, customer service, cvs, delivery, desktops, email, staff training, faxes, forms, hr"
25694422.pdf,"insurance benefits verification and authorizations, business processes, case management, computer literate, counselor, criminal justice"
26167298.pdf,strategic planning business competitive analysis
26234972.pdf,"editing, workflow"
26291616.pdf,"accounting, active directory, apple, architect, backup exec, capacity planning, citrix, cca, citrix certified administrator, citrix metaframe"
26919036.pdf,professional summary
27096471.pdf,"ada, benefits, budget, business process improvement, interpersonal communication, consulting, client, clients, employee relations, filing, focus"
27726066.pdf,excellent interpersonal skills
27788376.pdf,extensive experience with microsoft
28243590.pdf,"experience with ifc jeopardy projects, portfolio management"
28951817.pdf,"skilled in microsoft office suite, adobe premier suite, sql database, and sas data management"
29076405.pdf,microsoft word
29196643.pdf,"advertising, apple, budget, css, client, clients, databases, database, event planning, event management, google analytics, html, java"
29297393.pdf,training and development
29647215.pdf,"testing, cerner, clients, documentation, integration, integrator, design documentation, test scripts, training, documenting, change control"
29723311.pdf,preventive and reparative maintenance
29770086.pdf,"adobe, agile, scrum, analytical skills, social media, seo, sem, pr, pricing, product marketing, product testing, optimization, promotions, and"
30083884.pdf,"architect, business process, competitive, consulting, contracts, client, clients, design and construction, documentation, engineering support"
30863060.pdf,"unix, sql server, sql server, sql server r, vmware, odbc, sql, plsql, access, ms office suite, ms"
31016926.pdf,"golive, approach, benefits, budget, business development, c, change management, change management, contracts, corporate communications"
31169070.pdf,"adobe suite, application development, approach, assembler, billing, business analysis, c, carpenter, cl, client server, hardware, hardware"
31201660.pdf,applying lean principles to various businesses
31217840.pdf,"demonstrated, handson experience in leanagile, sdlc, waterfall, agile, itil, gap analysis, uat, business requirements, process"
31395742.pdf,"microsoft windows operating systems windows nt, xp, vista, and win"
32433431.pdf,"sales, marketing, sales and, operations, and marketing, api, integration, integrator, budget, financial services, from sales, outside sales"
33919379.pdf,pharmacy operations
34875813.pdf,"accounting, accounts payable, accounts receivable, acquisitions, approach, agency, banking, benefits, billing, budget, business communication"
37818861.pdf,"budgets, budget, consulting, customer service, driving, fast, hiring, inventory, inventory control, logging, logistics, materials, microsoft office suite"
38165833.pdf,excel and microsoft office read schematics and blue prints
38399177.pdf,"business correspondence, coaching, consultation, content, contracts, customer service, direction, employee training, team building, leadership"
38457612.pdf,"active directory, ad, analyst, architect, ccna, cisco certified, clustering, hardware, client, database, dhcp, dns, facilities management"
38896303.pdf,"apple support apple workstations, apple servers, ipad, iphone, mobile device management, apple remote desktop, xsan"
39308779.pdf,"accounting, accounting software, audit reports, audit report, audit reporting, consulting, dell, filing, finance, financial, financial reporting, focus, hp"
39441617.pdf,"accounting, active directory, ad, architect, borland, budgeting, business development, business management, business startup, c, c, cisco"
43311839.pdf,"net, net, aspnet, cnet, c net, aspnet, third generation, ado, agresso, ajax, api, application development, art"
43378989.pdf,"api, billing system, c, c, hardware, database, dns, ecommerce, eclipse, ejb, xml, ftp, hard drives, html, hubs, ide, information"
48533663.pdf,multiple facility management and oversight
49777184.pdf,crosscultural mediation expertise product development
51432451.pdf,"aix, automation, change management, citrix, consulting, client, clients, database, delivery, designing, documentation, ftp, hpux, hr"
51724595.pdf,"approach, art, benefits, developing business, change management, com, crm, crystal reports, client, data warehouse, documentation"
56792999.pdf,business process improvement  redesign project management
57364820.pdf,"ibmaix, application development, as, automate, automation, backup, ca, ca, change management, cics, ca, hardware"
57601040.pdf,organization
63670997.pdf,"advertising, approach, brand strategy, brand management, budget, com, content development, content, driving, email, event management, leadership, legal, marketing, market, marketing communications, marketing materials, marketing  sales, masonry, materials, media relations"
65062795.pdf,strong understanding of supply chain principles with an expertise in warehouse management
67406885.pdf,"acquisitions, billing, clients, explorer, win, phd, progress, record keeping, routing"
69181350.pdf,"familiar with spss software expert at ms word, excel and powerpoint proficient in databases such as gartner, forrester, datamonitor"
71888547.pdf,into the job
73075521.pdf,rna isolation knowledge
78016758.pdf,"go live, architect, audio, cisco, citrix, consultant, content and developing, content, delivery, designing, engineer, focus, hub, innovation, office"
79570655.pdf,"administrative support, clients, customer service, customer support, detail oriented, direct selling, filing, hematology, managing, medical"
80527194.pdf,"accountant, accounts payable, ap, ap, ar, bank reconciliation, banking, benefits, billing, budget analysis, budget, business administration"
88691367.pdf,"accounting, accountant, balance, budget analysis, budgets, change management, consultant, contracts, controller, cost control, credit"
88907739.pdf,strategy  operations cross functional team management
91116867.pdf,excellent communication skills
91189201.pdf,"web services, award, databases, maintenance, publishing, satisfaction, testing, web based, it infrastructure, excel, ms excel, spss, sql"
92246939.pdf,attends to detail
93349646.pdf,"go live, agile, architect, asm, automate, backup, budget, c, change management, strong interpersonal skills, excellent communication"
93459677.pdf,"abap, account management, reconciliation of balance sheet accounts, accounting, accounts payable, golive, ap, ar, automation, balance"
95350373.pdf,"case management, counseling, cpr, discharge planning, documentation, functional, health education, home health, hospice, instructor, assist"
95429627.pdf,"annual sales, cash, sales, sales of, inventory, filings, payroll, state tax, integration, integrator, solutions, increase, training, advertising"
95792386.pdf,complex problem solving outstanding interpersonal and organizational skills
99714410.pdf,"accounting, approach, automotive, baan, balance sheet, cash flow, coaching, continuous improvement, cost accounting, direction, driving"
10748989.pdf,building codes knowledge design process
10751444.pdf,cad
11155153.pdf,"extremely computer literate and proficient in the use of microsoft suites, word, excel, autodesk inventor pro  routed systems  tube and"
11722421.pdf,"photo, photoshop, cad, catalog, color, designing, fashion, drawing, hr, illustrator, information systems, materials, meetings, organizational"
11807040.pdf,strong clinical judgment
11919526.pdf,skills
11958994.pdf,"adobe, attorney, benefits, call center, cash registers, closing, good communication skills, interpersonal skills, oral, consultation, credit, client"
12415691.pdf,technical skills
12547982.pdf,proficient in autocad
12674307.pdf,"merchandising, communication skills, sales, retail, customer service, microsoft office, microsoft excel, multitasking"
13014900.pdf,"am proficient with graphics programs such as adobe photoshop, indesign, illustrator plus word programs such as microsoft word and excel"
13518263.pdf,"budgets, color, content, clients, direction graphic, interior design, presentations, space planning, specification, and vision"
13557622.pdf,"d, photoshop, animation, game design, lighting, maya, modeling, painter, people skills, quality, reality, rendering, sales, sound, sound design"
13774329.pdf,"blueprints, budgeting, budgets, budget, content, negotiate contracts, clients, customer service, documentation, drafting, equipment operation"
13998435.pdf,"d, approach, art, agency, autocad, basic, budgets, budget, color, concept, concept development, content, council, client, clients"
14528265.pdf,"d, basic, blueprint, blueprints, designing, doors, layout, window, multitasking, packaging, quick learner, reading, safety, shipping, tops"
14724186.pdf,"photoshop, art, budget preparation, budgets, budget, contracts, client, clients, customer service, layout, leadership and training, materials"
14743911.pdf,"training, microsoft office, ms office, award, budget, articulate, adult learning, electronic warfare, avionics, instructional design"
15425154.pdf,"acquisitions, adobe, adobe photoshop, advertising, artist, art direction, brand strategy, branding, brochures, budget planning, budgets, budget"
15471999.pdf,cash handling accuracy flexible schedule
15936656.pdf,"painting, swimming, cooking, photographing, playing piano"
16288901.pdf,able to meet deadlines
17199951.pdf,"adobe illustrator, photoshop, premier, autocad r, broadband, consultant, cost analysis, client, clients, design and construction, hvac"
17555081.pdf,"administrative, administrative support, budget management, budgets, cancer, data collection, direction, event planning, finance, financial"
18198627.pdf,photoshop
18460045.pdf,"acrobat, dreamweaver, adobe photoshop, art, balance, banners, brand identity, brochure design, creative design, clients, editing, email"
18795567.pdf,"d, d design, adobe creative suite, photoshop, cad, chinese, color, css, clientele, direction, engineering design, focus, graphics, graphic"
18835363.pdf,program development
18979238.pdf,"arts, blueprint reading, bridges, computer experience, direction, documentation, edit, engineer, english, french, german, government, graphic"
19164410.pdf,adobe illustrator
19195747.pdf,"this retail store was a newest branch of an old, well established, family owned chain of stores from the east side of the state the family had"
20390397.pdf,"microsoft office word, excel, powerpoint, outlook, autocad, microstation, projectwise explorer"
20748926.pdf,"account receivables and payables, administrative duties, aia billing, scheduling appointments, customer service, data entry, expense reports"
20932019.pdf,catia v solidworks
20986595.pdf,"adobe, ad, ads, advertising, audio production, basic, budget planning, chinese, com, computer knowledge, consulting, content, client, clients, desktop publishing, direction, editing, edit, english, google analytics, http, illustrator, indesign, inspect, layout, leadership, mac, mandarin"
21283733.pdf,"ada, photoshop, advertisements, business communications, business development, catalogs, content, copyediting, css, client, clients, database"
21705160.pdf,"graphic designer, posters"
21916744.pdf,"adobe creative suite, acrobat, photo, photoshop, advertisements, art, avenue, c, color, com, communication skills, css, client, clients"
22496394.pdf,"civil d, autocad, civil engineering drafting, office skills, coaching, customer service, documentation, leadership, marketing, problem"
22506245.pdf,"adobe indesign, photoshop, illustrator, and acrobat professional"
22567495.pdf,course development
22675694.pdf,"desktop publishing software photoshop, illustrator"
23951429.pdf,client and vendor relations detail oriented
24285142.pdf,"d, acrylics, acrobat, adobe, dreamweaver, photoshop, ads, air force, animation, banners, bash, book, brochures, brochure, bi, cd, color"
24455357.pdf,knowledge of textiles proficient in english and spanish
24583187.pdf,"administrative, acrobat, adobe creative suite, photoshop, apple, approach, autocad, budgets, building codes, c, consulting, council, clientele, client, clients, fast, floor plans, illustrator, indesign, interior design, microsoft office suite, office, project management, quick, revit"
24655918.pdf,invoicing quick books
25023614.pdf,"presentations courses in id business, materials, kitchen  bath, and history of interiors provide us with the tools and ability to work"
25061645.pdf,"adobe creative suite, dreamweaver, photoshop, advertising, arts, art, branding, brochures, chinese, coreldraw, css, clients, due diligence"
25422388.pdf,"selfmotivated, senseofhumor, conceptual thinker, attentionto leadership skills, friendly attitude, professional behavior, expert"
25949631.pdf,"accounting, bookkeeping, budget development, content development, customer service, database creation and maintenance, employee training"
26046064.pdf,expert knowledge in the following software programs
26496059.pdf,adobe photoshop microsoft wordexcel
26503829.pdf,adobe cs adobe illustrator flex plm grovesite
26622051.pdf,"d, adobe photoshop, auto cad, autocad, cad, client, data entry, databases, editing, esri, gis, gps, illustrator, indesign, laser"
26676567.pdf,"desktop publishing software photoshop, illustrator, html, indesign"
26790545.pdf,"adobe creative suite, adobe dreamweaver, adobe illustrator, adobe photoshop, powerpoint, keypoint, prototyping, wireframes and"
26924514.pdf,budgeting and finance team leadership
26942552.pdf,persuasive communication
27497542.pdf,microsoft office word
27529455.pdf,"academic, adobe, backup, coaching, conferences, counseling, course development, crystal reports, curriculum design, curriculum development"
28326441.pdf,project management computer drafting
28663949.pdf,"cad drafter, d rendering, space planning, ffe, sales, project finance, project management, multitasking, team player, soon ncidq"
29147100.pdf,adobe photoshop intermediate html coding
29524570.pdf,work history
29865476.pdf,over  years of customer service experience
30965258.pdf,guest relations
30968749.pdf,"certification six sigma, greenbelt"
32532982.pdf,"autocad, bentley autoplant, cadworx, autodesk vault, navisworks, microstation, flexcad, microsoft word, excel, outlook, powerpoint"
32954522.pdf,"advertising, cash register, resolve customer complaints, client, clients, customer service, delivery, designing, filing, financial, focus, inventory"
34051710.pdf,"academic, acrobat, photoshop, ads, arts, art, banners, brochures, budget, cashier, color, conferences, database, designing, dos, edit, filing"
34317538.pdf,user centered design
34349255.pdf,"budgets, budget, concept, clients, materials, meetings, presentations, pricing, procurement, sales, specification, spreadsheets"
34511655.pdf,"adobe creative suite, photo, ad, art, backup, brand strategy, calibration, catalog, color, content, creative direction, css, client, direction, e"
34657584.pdf,"d, adobe, adobephotoshop, autocad, c, consultant, coreldraw, client, delivery, designing, dos, english, estimating, macromedia"
35990852.pdf,visual studionet
36269672.pdf,team leadership
37058472.pdf,autocad drafting
37263609.pdf,"personal rhino, revit, cinema d, alladobe cs, autocad, hdr imaging, lighting, market research, dmax, maya, revit, modeler"
37664296.pdf,"adobe, ads, branding, business operations, business solutions, concept, consulting, creative direction, creative director, entrepreneur"
37695494.pdf,"d, adobe creative suite, photo, ad, arts, attention to detail, cadcam, catalogs, designing, ecommerce, english, fashion, drawing"
38565119.pdf,direction
38744475.pdf,adobe creative suite
39252859.pdf,childrens trade k  advertising
39434376.pdf,spanish
39776400.pdf,creating bills of materials negotiation skills
41506705.pdf,microsoft office proficient
42384185.pdf,"d, d modeling, ds max, adobe, adobe after effects, adobe photoshop, automotive, cms, sc, client, cvs, direction, dreamweaver"
44145704.pdf,technology orientated
44185767.pdf,"agile, application development, army, business strategy, c, consultant, consulting, cost analysis, client, clients, delivery, direction, erp, focus"
51018476.pdf,"cad software iman teamcenter, unigraphics nx"
51681660.pdf,"aftereffects, photo, photoshop, ad, art, avid, budget, drafting, edit, film, lighting, director, excel, powerpoint, ms word, natural, composer"
54201930.pdf,"marketing, clients, ads, basis, sales, translated, solutions, advertising, brand identity, budgets, dreamweaver, flash, freehand, hansen"
62312955.pdf,"digital illustration of art concepts for print, fabric and web applications using adobe creative suite"
67582956.pdf,"d, autocad, design software, detailoriented, engineer, meetings, excel, microsoft word, microstation, modeling, team player"
68240723.pdf,"critical thinker  using logic and reasoning to identify the strengths and weaknesses of alternative solutions, conclusions or approaches to"
76010167.pdf,"photo, advertising, arabic, artist, arts, art, agency, basic, good communication skills, computer literate, creativity, database, dec, designing"
78149576.pdf,"billings, cash handling, cashier, creativity, customer service, magic, pick, pos"
81011612.pdf,"d, photoshop, advertising, animation, business management, chemistry, computer networking, customer service, database analysis, designing"
85101052.pdf,"asset management, automation, business systems, c, controller, client, database, designing, eclipse, eclipse, engineer, english, ejb, xml"
91153752.pdf,"sketch, illustrator, photoshop, indesign, invision, omnigraffle, html, after effects, keynote, revit, rhino, autocad, watercolor"
93301686.pdf,"d modeling, army, basic, budget analysis, bi, drivers, driving, editing, instructor, job analysis, listening, mechanical, excel, microsoft office"
94417768.pdf,corel draw graphics proficient
10005171.pdf,"academic, ads, advertising, banners, brochures, budget, conferences, special events, market research, marketing, materials, newspaper, office"
10515955.pdf,detail oriented
11005406.pdf,"cisco, exchange, firewall, iis, internet information services, it support, layout for, microsoft windows, r, sap, security, system security"
11270462.pdf,"associate, basis, greeting, inventory, monthly sales, sales, sales associate, sales or, stocking, marketing, posting, clients, filing, increase"
11677012.pdf,experience
12085736.pdf,"ad, advertising, bb, basic, competitive, contract management, credit, css, client, clients, customer support, client support, dbm, delivery, e"
13328680.pdf,"clients, strategic"
13343786.pdf,benefits and payroll coordination
13503650.pdf,"administrative support, conflict resolution, meetings, outlook"
13837784.pdf,"account management, photo, budget, content, cpi, creative director, client, clients, drupal, senior management, html, internet marketing"
14036515.pdf,"telephones, invoices, greeting, incoming calls, security, switchboards, clerk, medical records, ms word, office, billing, shipping, shipping"
14209965.pdf,"m edia planningbuying softward mediaocean, dds, mediavisor, aspen, strata, dart dfa and dfp"
14556869.pdf,"general software proficiency microsoft office, microsoft works, microsoft customer relationship management system, microsoft"
