File Name,Skills
10554236.pdf,"accounting, general accounting, accounts payable, program management"
10674770.pdf,"accounting, accounts payable, accounts receivable, adp, advertising, ar, balance sheet, balance, bank reconciliations, benefits, billing, billings"
11163645.pdf,"accounts payables, accounts receivables, accounts payable, accounts receivable, administrative functions, trial balance, banking, budget, bi"
11759079.pdf,"accounting, balance sheet, budgets, client, clients, derivatives, drafting, equity, financial, financial accounting, financial statements, fixed assets"
12065211.pdf,aderantcms financial reporting
12202337.pdf,"internet and microsoft office  ms word, ms power point, ms excel, pivot tables, spreadsheets"
12338274.pdf,"d, accounting, accountant, accounts receivables, adobe illustrator, adobe photoshop, pagemaker, audio editing, auditing, banking, book"
12780508.pdf,superior attention to detail
12802330.pdf,"accounting, accounting systems, ad, analytical skills, auditing, automation, billing, budgeting, budgets, budget, business operations, business"
13072019.pdf,business writing organized and detailoriented
13130984.pdf,budget forecasting expertise general ledger accounting
13294301.pdf,microsoft office data entry
13491889.pdf,full accounting cycle auditing
13701259.pdf,microsoft wordexcel
14055988.pdf,grant management
14126433.pdf,"account reconciliations, accounting, accounts payable, accounts receivables, accruals, ad, ap, balance sheet, balance, bank reconciliations, billing"
14224370.pdf,quick learner
14449423.pdf,time management
14470533.pdf,"training, fairbanks, ak"
14491649.pdf,"account reconciliations, accounting, accruals, ad, as, balance sheet, balance sheets, budgets, budget, controller, corporate finance, erp"
14496667.pdf,able to retain the confidentiality of paperwork and information
15289348.pdf,"internet accounting, finance and tax research  lexisnexis, cch  ria"
15592167.pdf,communication skills  taking initiative in communication among team members by interacting with people from diverse cultural
15821633.pdf,"accounting, administrative, agency, audit report, backup, bank reconciliations, basic, billing, budgets, cash register, cashier, catalog, clerical"
15906625.pdf,years of experience in accounting  bookkeeping
16237710.pdf,invoice coding familiarity complex problem solving
17306905.pdf,power user of microsoft excel epicor netsuite quickbooks hyperion great plains sage intacct
17407184.pdf,"accounting, billing, change management, contracts, client relations, database, delivery, eclipse, finance, financial reporting, financial statements"
17556527.pdf,"accounting, accounting software, accounts payables, accounts payable, accounts receivables, accrual, administrative, administrative support"
18132924.pdf,analytical reasoning effective time management
18365791.pdf,accounts receivable professional
18569929.pdf,"accounting, accounts payable, accounts receivable, accruals, acquisitions, billing, closing, consulting, contracts, controller, credit, customer"
18635654.pdf,"accounting, accountant, arabic, balance sheet, bank reconciliations, com, resolve customer complaints, customer service, databases, delivery, email, english, expense reports, financial, financial and accounting, financial statements, forms, general ledger, lecturer, excel, office, microsoft"
18669563.pdf,"accounting, accountant, administrative, army, agency, backup, book, budget, business administration, cash flow, contracts, dc, documentation"
19446337.pdf,financial statement analysis general ledger accounting
19545827.pdf,"accounting, sales, inventory, payroll, the accounting, reconciliations, bookkeeper, audits, operations, ap, ar, assembly, closings, contracts"
20082776.pdf,"attention to detail goal oriented accounts payable, receivable, manager"
20253563.pdf,resultsoriented
20345168.pdf,general ledger accounting
20393721.pdf,"quickbooks, sage, lacerte, and intuit proseries wellrounded on the applications and functions, microsoft suite word advanced, excel"
20624984.pdf,"account reconciliations, accounting, accounts payable, accounts receivable, ap, balance sheet, bank reconciliation, banking, billing, book"
21031285.pdf,"account reconciliation, accounting, accountant, accounting system, ar, budget, business objects, closing, contracts, financial, financial analysis"
21338490.pdf,"account reconciliation, accounting, general accounting, accounting software, accounts payables, accounts receivables, ap, arabic, balance sheet"
21763056.pdf,"account reconciliation, accounting, accounts payable, accruals, accrual, balance sheet, balance, balance sheets, bank reconciliation, benefits"
21853199.pdf,analytical reasoning strong organizational skills
22465498.pdf,financial management
22925443.pdf,budgeting
23139819.pdf,"accounting, accounts payable, adp payroll, ad, ap, audit reports, balance, balance sheet, bank reconciliations, bank reconciliation, billings"
23246831.pdf,"account management, accounts receivables, administrative functions, administrative support, billing, billings, billing systems, clarify, hardware"
23387174.pdf,managerial aptitude
23416654.pdf,advanced excel skills
23438112.pdf,strong communication skills
23513618.pdf,work history
23636277.pdf,"accounting, accounts payable, accounts payable, accounts receivable, acquisitions, adobe, approach, auditing, trial balance, balance, balance"
23734441.pdf,work history
24103168.pdf,"it excel, access"
24294778.pdf,meticulous attention to detail
24703009.pdf,complex problem solving
24799301.pdf,"accounting, cpa, local area network, peachtree accounting, reporting, web site"
24817041.pdf,"account reconciliations, accounting system, accounts payable, process payroll, spreadsheets"
25067742.pdf,"general accounting, accounts payable, accounts receivable, microsoft office, outlook, windows xp, word, excel, quickbooks enterprise"
25127518.pdf,billing and collections ms office suite
25462793.pdf,"account reconciliations, accounting, accounting systems, accounts receivable, accruals, ap, ar, attention to detail, bookkeeping, budget, cash"
25547145.pdf,experience
25749150.pdf,"accounting, accountant, accounts payable, accounts receivable, billing, book, cpt, finance, financial, financial accounting, financial statements"
25846894.pdf,"timberline, mri, yardi, peachtree, peoplesoft, onesite, quickbooks microsoft word and excel"
25862026.pdf,"account reconciliation, accounting, general accounting, accruals, ad, agency, balance sheets, billing, budgets, budget, charts, compliance"
25867805.pdf,"account reconciliations, accounting software, accounts payable, bank reconciliations, filing, financial reports, financial statement preparation"
25935030.pdf,accomplishments
26065877.pdf,microsoft ax dynamics
26975573.pdf,"lawson, invision, quickbooks, ms word, excel, powerpoint, lotus notes, and meditech"
27558837.pdf,"accounting, accountant, accounts payable, balance sheet, budget planning, cms, controller, credit, data mining, senior management, finance"
27573855.pdf,accomplishments
27980446.pdf,"microsoft office excel, outlook and word, sage, ramp wms software and syspro erp program"
28298773.pdf,"sap, great plains dynamics, sage, quickbooks pro, act, microsoft word, excel pivot tables and vlook up access, powerpoint"
28359817.pdf,"accounting, accounts payable, accruals, ap, as, automotive, trial balance, balance sheets, bank reconciliations, benefits, budget"
28614791.pdf,microsoft office  advanced knowledge and skill
28939941.pdf,"visual basic net, accounting, photo, advertising, arabic, budgets, business administration, conferences, databases, english, exhibitions, fast"
28969385.pdf,compliance testing knowledge sec and call reporting proficiency
29050809.pdf,monthend close activities  reconciliationsanalysis
29456173.pdf,"account reconciliation, accounting system, ar, budget, business objects, closing, contracts, financial analysis, financial controls, financialoperations, financial reports, financial statements, gl, grants, inventory, invoicing, ledger, macros, access, excel, microsoft office, office"
29821051.pdf,usgaap principles
29999135.pdf,selfmotivated conflict resolution
30304575.pdf,accounting and financial reporting powerful negotiator
30361788.pdf,creative problem solving skills
30813919.pdf,good communication
31602598.pdf,computer applications
33527446.pdf,excel spreadsheets professional and mature
34198885.pdf,experience
34816637.pdf,"income statement, balance sheet, budget expense vs actual expense, when necessary prepare income statements for special events yearly"
35554162.pdf,oracle accounting
36024962.pdf,"accounting, ap, ar, balance sheet, benefits, billing, cash flow, cash management, credit, client, finance, financials, director, payroll, yearend"
36425270.pdf,account reconciliation specialist
37370455.pdf,"accounting, accounting software, accounting system, accounts payable and receivable, accounts receivables, ap, ar, as, balance sheet"
37997506.pdf,"academic, account reconciliation, accounting, accountant, accounting systems, accounts payable, accounts payables, accounts receivable"
38847011.pdf,qualifications
39115899.pdf,"accounting, approach, as, auditing, bank reconciliations, competitive, contracts, crm, clientele, clients, customer satisfaction, customer"
39674178.pdf,budget allocation budget analsis
42487883.pdf,corporate ga and cogs accounting
43685045.pdf,"credit, purchase orders, accounts payable, file, million, sales, sales and, sales tax, tax returns, collections, litigation, loans, team lead"
49204385.pdf,problem solver sec and call reporting proficiency
49997097.pdf,"accounting, ap, auditing, balance sheet, bank reconciliations, billing, budget, business operations, business processes, contracts, clients, decision"
50222417.pdf,"account reconciliation, accounting, accountant, accrual, abc, streamline, adp and payroll, ad, ap, ar, balance sheet, billings, biotechnology"
53640713.pdf,"reconcile balance sheet accounts, account reconciliations, accounting, accountant i, accountant, accounting system, accounts payable and"
59403481.pdf,accounting operations professional
62809577.pdf,"key by touch, accounting software, accounts payable, accounts receivable, administrative, aia, as, billing, billings, controller, draw"
63137898.pdf,periodic financial reporting expert strategic planning
75286906.pdf,"account management, accounts payable, accounts receivable, administrative, adp, ap, bank reconciliation, basic, billing, closing, cms"
78257294.pdf,personal information
78403342.pdf,"accounting, balance, budget, business analyst, call center, cash management, closing, contracts, critical thinking, client, clients, databases"
80053367.pdf,healthcare
87635012.pdf,"microsoft excel, peachtree, peoplesoft, sap, sarbanesoxley, sql"
98559931.pdf,"accounting, ap, attention to detail, bank reconciliation, interpersonal, data entry, fashion, finance, general ledger, leadership"
10186968.pdf,sensitive
10818478.pdf,administrative
11174187.pdf,"care planning, case management, home health, hospice, infection control, injections, nurse manager, oncology, scheduling, staff development"
11188218.pdf,in oral and written formats
11773767.pdf,"account management, agency, benefits, billing, cisco, coach, coaching, com, counseling, client, client relations, customer relations, customer"
11963737.pdf,data analysis business artifacts documentation
12171093.pdf,"filing, professional and friendly, careful and active listener, multitasking"
12544735.pdf,"allergies, attention to detail, cpt, clients, emotional support, forms, home health, hospice, icd, ids, insurance, leadership, law, medical"
13072354.pdf,"conflict resolution, advocacy, group facilitation, program development, youth advocacy, outreach, microsoft office, training, counseling"
13115648.pdf,client relations creative problem solving customer service
13342150.pdf,maintains strict confidentiality
13593241.pdf,"academic, administrative, aims, approach, arts, art, book, council, critical thinking, database, essays, special events, leadership, leadership"
13809698.pdf,phlebotomy knowledge sharp critical thinker
13909762.pdf,"greet, telephone customer service, cash, credit, sales, vouchers, optical, payments, training, inventory, pricing, billing, forecasts, greeting"
13967854.pdf,creative problem solving
14064815.pdf,strong interpersonal skills
14146106.pdf,filing and data archiving
14176254.pdf,"quality analysis, training, teaching, mentoring, coaching, life coaching, advertising, agency, coaching, customer satisfaction, customer service"
14445309.pdf,"training, liaison, federal government, public policy"
14708590.pdf,"healthcare claims authorization, computerized and paper claims submission people skills advanced problemsolving, great organizational skills"
15313140.pdf,"advertising, cash registers, coach, conferences, cost reduction, credit, resolve customer complaints, clients, delivery, directing, employee training"
15337481.pdf,skills
15727656.pdf,"peer counseling, customer service, database, documentation, internet applications, excel, email, office, outlook, power point, publisher"
16332348.pdf,excellent writing and critical thinking skills
17165107.pdf,"health promotion, nutrition counseling, exercise testing  prescription, health and fitness speaker, microsoft office excel, powerpoint, word"
17254634.pdf,trained in compounding all intravenous and chemotherapy admixtures
17847636.pdf,"key, administrative assistant, attention to detail, billing, cpr certified, cpt, data entry, data base, delivery, diagnosis, dispatching"
17911230.pdf,excellent classroom management positive atmosphere promotion
18090899.pdf,excel and google sheets marketing
18725071.pdf,"mental health, excel, powerpoint, windows, microsoft word, quality teaching"
18997135.pdf,"chinese, conferences, clients, english, meetings, access, excel, microsoft office, powerpoint, word, business presentations, progress, quality"
19063156.pdf,"account reconciliations, accounting, accounts payable, apollo, auditing, benefits, billing system, coach, com, credit, client, customer satisfaction"
19108760.pdf,key account generation
19234823.pdf,exceptional interpersonal communication
19518606.pdf,operations management
19926135.pdf,strong interpersonal skills
20138606.pdf,accomplishments
20272792.pdf,problem solving
20324037.pdf,customer service
20400279.pdf,active listening
20544228.pdf,"streamline, basic, budget, business development, maintain calendar, case management, charts, communication skills, customer service, data entry"
20604208.pdf,"microsoft office, word, excel, outlook, data entry"
20765795.pdf,empathetic
21614256.pdf,"word programs including excel and access, epic and other electronic medical records, and the database efforts to outcome eto"
22042181.pdf,customer service
22259475.pdf,client relations specialist
22391901.pdf,"handle cash, coaching, credit, customer satisfaction, customer service, delivery, inventory, mentoring, merchandising, networking, organizing"
23427369.pdf,maintains strict confidentiality team player with positive attitude
23577836.pdf,"associate, cash, cash register, credit, credit card, database, greetings, its, new sales, sales, sales associate, sales associates, telephone, administrative tasks, operations, ordering, wpm, archiving, billing, correspondence, data archiving, filing, microsoft office, ms office"
23804341.pdf,scheduling
24124250.pdf,"epic certifications in resolute hospital billing, home health and sbo"
24410405.pdf,focused on customer satisfaction
24588864.pdf,conflict resolution skills
24695561.pdf,"balance, benchmarking, bts, budget, contracts, council, counseling, customer satisfaction, databases, database, delivery, facilities"
24754689.pdf,"basic, benefits, cash receipts, counseling, credit, client, customer service, staff training, financial, firing, hiring, inventory, leadership, materials"
24763208.pdf,"training, recruiting, sales, sales goals, cpr, therapeutic, teaching, and sell, assistant director, basis, writing skills, audits, budgets, financial"
24946537.pdf,persuasive negotiator
25873425.pdf,public safety
26071861.pdf,"academic, active directory, antivirus, audio, cables, cabling, hardware upgrades, computer hardware, client, clients, database, documentation"
26456474.pdf,skills used
27182111.pdf,"allergies, blood draws, budget, charts, coaching, cpr, decision making, ekgs, equipment maintenance, filling, financial, first aid, health education"
28111403.pdf,project management employee relations
28206098.pdf,seasoned in conflict resolution
28635795.pdf,"administrative, administrative duties, agency, case management, client, clients, customer satisfaction, database, fluent in english, english, farsi"
28871170.pdf,"agency, attorney, business plans, consultant, client, clients, detail oriented, grant proposals, legal, materials, organizing, policies, press releases"
28974459.pdf,energetic work attitude
29173771.pdf,have directors credential
29177904.pdf,decision making
29415426.pdf,strong problem solver microsoft office proficiency
29926588.pdf,strong
30741799.pdf,compassionate
31040875.pdf,"child care, council, government, meetings, money, progress, sales, social services, staffing"
31242382.pdf,customer service expert invoice processing
32965335.pdf,with understanding of network wireless technical concepts eager in learning new concepts quickly friendly demeanor that is easy to work with
34327438.pdf,"business operations, c, contracts, credit, clients, documentation, drafting, finance, financing, financial, funds, insurance, law, legal, legal"
34970271.pdf,"accounts payables, accounts receivables, administrative, benefits, billing, oral, customer service, customer support, database, documentation"
35344611.pdf,talent assessments
35474904.pdf,skills
36392131.pdf,excel spreadsheets
36694627.pdf,"key, adding machine, approach, agency, banking, basic, bonds, case management, cash handling, clerical, conflict resolution, copying"
37333719.pdf,education
37348041.pdf,experience
37560528.pdf,"such as, cooking, household chores, laundry, personal hygiene, interpersonal communication, and the effects of domestic violence as well as"
37640804.pdf,fluent in conversational spanish
38059130.pdf,"human resources, training, employee relations, recruitment, organizational development, payroll, purchasing, equal employment opportunity"
38291889.pdf,"acquisitions, agency, billing, billings, clerical, coach, coaching, clients, email, senior management, filing, financial, hiring, human resources, hr"
38698573.pdf,networking and partnership development
38860712.pdf,"goaldriven leader who maintains a productive climate and confidently motivates, mobilizes, and coaches employees to meet high"
40088790.pdf,leadership
42164460.pdf,resultsoriented filerecords maintenance
44115326.pdf,"aix, security, linux, hacmp, veritas, websphere, maintenance, network file system, nfs, oracle, unix, systems administration, dns, veritas"
46772262.pdf,"i am confident in my ability to navigate computers, communicate effectively, value teamwork, respect all members of the healthcare team, value all"
47133747.pdf,"accounting, approach, agency, backup, business management, call center, coaching, competitive, contracts, cost control, clientele"
49475708.pdf,"calculators, cash registers, closing, cooking, credit, funds, inventory, issue receipts, mark, money, windows, nice, paint, policies, quality, maintain"
49486820.pdf,strong organizational skills seasoned in conflict resolution
53169257.pdf,"administrative, c, community health, clients, direction, logistics, meetings, mentor, works, needs assessment, processes, public relations, quantitative analysis, simulation, treatment plans"
54067174.pdf,customer service expert customerfocused
72652441.pdf,creative problem solver ms windows proficient
73448369.pdf,fast data entry
74191424.pdf,strong work ethnic
75057933.pdf,selfmotivated
75435017.pdf,process evaluation
75950464.pdf,motivating students microsoft word expertise
77439230.pdf,personal and professional integrity
78538268.pdf,"marketing, clients, product positioning, public relations, interviewing, recruiting, community relations, operations, case management"
80503242.pdf,"more than  years experience in healthcare, business development, marketing and planning analysis"
89508407.pdf,detailoriented goaloriented
90468982.pdf,"atm, auditing, call center, cash handling, cash register, credit, client, customer satisfaction, excellent customer service, customer service, debit"
91051945.pdf,"account management, business development, business operations, cisco, international business, logistics, oracle, purchasing, sales"
93512385.pdf,"insurance, managing, office"
95714702.pdf,patient and diligent
95970987.pdf,"psychology human behavior and personality disorder academic, various agencies worked and volunteered and interned fr mayor bill di blasio"
97405769.pdf,superb sales professional store planning and design strong communication skills detailoriented personnel training and development time
10953078.pdf,"balance, banking, basic, charts, oral, basic computer skills, conferences, direction, instructor, meetings, office, organizational skills, progress"
11197262.pdf,accomplishments
11676151.pdf,"system software adobe dreamweaver, skills monitoring daily production runs, for technical support, ie, disc backups, database verifications, statistics reports performed complexity installation and maintenance of software skills in electronic medical records, adobe flash, help desk"
11813872.pdf,"deep expertise in designing, developing"
12341902.pdf,exceptional communication skills and outstanding outstanding interpersonal and rapport building skills
12674256.pdf,"team mediation, budget management, delegation expert with a focus on results and team growth"
14140903.pdf,great organizational skills
15053703.pdf,"public speaking, student involvement, and organizational"
15546686.pdf,"banking, chemistry, customer support, dna, gc, government, marketing, materials, network, reporting, research, sales, teaching, trainer"
15603319.pdf,"data collection, maintain inventory, statistical analysis, prepare sample and microsoft office"
16172429.pdf,"accounting, basic, bloomberg, c, charts, credit, credit risk, documentation, senior management, financial, analyze financial statements, financial"
16507693.pdf,microsoft office wordoutlook excelpower point
16653657.pdf,"hplc, gc, physical chemistry, uvvis"
16661264.pdf,"taams, arcgis, trimble unit, garmin, atv, personal computer  microsoft excel, powerpoint, microsoft word, write and read"
16849128.pdf,production and processing  basic computer skills
17312146.pdf,"microsoft word documents, excel spreadsheets and power point presentations experienced in arc geographic information systems"
17499196.pdf,physical planning and land management
17640785.pdf,"microsoft word, excel, powerpoint, office, outlook, rstudio"
18242317.pdf,"data collection, maintain inventory, statistical analysis, prepare samples"
18264694.pdf,skilled
19532392.pdf,"accounting, business intelligence, business law, hardware, customer satisfaction, customer services, data entry, databases, database"
19851252.pdf,"cashiering, closing, directing, direction, excel, power point, microsoft word, quality, safety"
20006992.pdf,"data entry, printers, clients, loans, tax returns, clerk, multiline, maintenance, recruiting, recruitment, testing, games, instructor, teaching"
20969119.pdf,"administrative, budget, business process improvement, change management, coach, contracts, customer service, delivery, direction, finance"
21134923.pdf,"dream weaver, adobe illustrator, agency, budgeting, budget, business development, business plans, c, delivery, english, estimating, finance"
21868149.pdf,"administrative, approach, business development, coaching, communication skills, computer literate, concept, council, client, data collection, data"
23631188.pdf,resolve outstanding issues timely
24068423.pdf,"automation, consultant, dec, fertilizer, grant proposals, irrigation, managing, meetings, modeling, oct, phd, processes, research, scheduling"
24397882.pdf,"accounting, accounts payable, accounts receivable, adp, agency, billing, brio, budgeting, budgets, budget, bi, controller, conversion, certified"
24416961.pdf,collaborative leadership style and winwin process redesign and work flow planning capabilities
26070334.pdf,regulatory compliance
26835781.pdf,"sasspss statistical applications, windows xp, ms office, adobe indesign, banner web  baseline curriculum advising and program"
26921245.pdf,"analytical skills, quality control, research, safety, statistics, surveys, teaching, water quality, soil fertility"
27888251.pdf,"a tenacious, courteous, diplomatic, and professional self motivated individual who requires minimal supervision"
28165687.pdf,dependable and engaging
28247753.pdf,report writing
28733974.pdf,effective leader constant contact
29142288.pdf,customer relations
29510501.pdf,"publisher, access time management skills"
29746235.pdf,strong verbal communication
29897742.pdf,data management
29968330.pdf,"well acquainted with microsoft word, excel and powerpoint required in conducting researches this includes skills in designing data"
30437583.pdf,"adobe photoshop, anatomy, agency, biology, chemistry, conferences, database, direct marketing, drupal, edit, environmental health, gis"
34141299.pdf,"accounts payable, administrative, agency, billing, clerical, content management, credit, client, clients, customer satisfaction, customer service"
36102323.pdf,cash handling
37201447.pdf,excellent classroom management
38216888.pdf,strong interpersonal skills
40882926.pdf,"agency, book, consultant, event planning, fund raising, funds, innovation, leadership, managing people, media plans, mentoring, newspapers"
